{
  "schemaVersion": 1,
  "unitId": "volt",
  "silhouette": "Compact forward-leaning striker with a narrow torso, long lower legs and a lightning-bolt antenna.",
  "bodyParts": [
    "single angular head integrated into the torso",
    "two compact forearms with one striking gauntlet",
    "two reverse-jointed mechanical legs",
    "lightning-bolt antenna",
    "small rear power cell"
  ],
  "weapon": "Integrated short-range electric striking gauntlet on the leading arm.",
  "surfaceMaterials": ["dark graphite armor", "brushed gunmetal joints", "unit accent energy channels"],
  "identityConstraints": [
    "always keep exactly two arms and two legs",
    "the striking gauntlet stays on the leading arm",
    "the lightning-bolt antenna remains visible",
    "the rear power cell keeps the same size and position",
    "use the accent color resolved from game-balance.json"
  ],
  "negativeConstraints": [
    "handheld sword",
    "firearm",
    "cape",
    "human face",
    "lettering",
    "electric glow merged into the body silhouette"
  ],
  "notes": "Hand-authored identity reference for the player duelist and the mirror-match rival."
}
