{
  "schemaVersion": 1,
  "unitId": "relay",
  "silhouette": "Lean forward-swept pursuit body with a narrow sensor head, long spring legs and rear speed fins.",
  "bodyParts": [
    "single narrow sensor head",
    "two lightweight forearms",
    "two long spring-loaded mechanical legs",
    "paired rear speed fins",
    "small central drive core"
  ],
  "weapon": "Compact close-range pulse emitter integrated into the leading forearm.",
  "surfaceMaterials": ["dark graphite shells", "light gunmetal joints", "unit accent drive channels"],
  "identityConstraints": [
    "always keep exactly two arms and two legs",
    "keep both rear speed fins visible and equal in size",
    "preserve the long lower-leg proportions",
    "the drive core remains centered in the torso",
    "use the accent color resolved from game-balance.json"
  ],
  "negativeConstraints": ["heavy tank armor", "handheld sword", "long rifle", "cape", "human face", "lettering"],
  "notes": "Hand-authored identity reference reused by the rush and cryo rival protocols."
}
